{
  "type": "clickhouse",
  "kind": "implementation",
  "category": "search_analytics",
  "name": "ClickHouse",
  "description": "Columnar OLAP engine delivering sub-second aggregations over billions of rows.",
  "version": "0.1.0",
  "capabilities": [
    "columnar_scan",
    "materialized_views",
    "high_ingest_rate"
  ],
  "helps_with": [
    "realtime_analytics_dashboards",
    "funnel_cohort_queries"
  ],
  "does_not_solve": [
    "row_level_updates",
    "oltp_transactions"
  ],
  "risks": [
    "merge_background_pressure",
    "sparse_index_granularity"
  ],
  "common_patterns": [
    "cqrs"
  ],
  "failure_modes": [
    "merge_queue_backlog",
    "memory_limit_kills"
  ],
  "tradeoffs": [
    "analytical_speed_vs_update_semantics"
  ],
  "capacity_defaults": {
    "safe_reads_per_sec": 50000,
    "safe_writes_per_sec": 25000,
    "default_instances": 1
  },
  "cost_defaults": {
    "usd_per_node_month": 350
  },
  "palette": {
    "group": "Search & Analytics",
    "icon": "box",
    "color": "#0f766e"
  }
}
