{
  "type": "reranker",
  "category": "ai_genai",
  "name": "Reranker",
  "description": "Model service that re-scores and re-orders retrieved documents or candidates to improve relevance ranking after initial retrieval stages.",
  "version": "0.1.0",
  "capabilities": [
    "cross_encoder_scoring",
    "relevance_ranking",
    "candidate_reordering"
  ],
  "helps_with": [
    "search_result_quality",
    "retrieval_precision",
    "final_answer_relevance"
  ],
  "does_not_solve": [
    "initial_candidate_generation",
    "large_scale_indexing"
  ],
  "risks": [
    "added_latency_in_pipeline",
    "model_overfitting_to_specific_domains"
  ],
  "common_patterns": [
    "two_stage_retrieval",
    "score_normalization",
    "cascade_ranking"
  ],
  "failure_modes": [
    "model_loading_failure",
    "score_inconsistency",
    "latency_exceeding_sla"
  ],
  "tradeoffs": [
    "ranking_quality_vs_latency",
    "cross_encoder_vs_bi_encoder_accuracy"
  ],
  "capacity_defaults": {
    "rps_per_instance": 3000,
    "p95_base_ms": 30,
    "default_instances": 2
  },
  "cost_defaults": {
    "usd_per_instance_month": 80
  },
  "palette": {
    "group": "AI/GenAI",
    "icon": "ArrowUpDown",
    "color": "#8b5cf6"
  },
  "kind": "implementation"
}
